{"protocol_version":"coop-native-v1","schema_digest":"2f3bc99e53080fa11b39592b64fb0ab964a16f568719a2622d0b2caf766ab629","provenance":{"artifact":"sts2-protocol/coop-native-v1","source":"schemas/coop-native-v1.schema.json","generator":"hand-authored"},"correlation_id":"corr:native:action:recovered","instance_id":"instance:native-test","session_id":"session:native-test","lease_id":"lease:native-test","lease_epoch":7,"kind":"recovery_response","operation_id":"op:native:action:unknown","actor_peer":null,"expected_host_generation":null,"action":null,"vote":null,"status":null,"observation":null,"effect":null,"recovery":{"kind":"reconcile","rejoin_epoch":1},"catalog":null,"receipt":null}
