{"protocol_version":"coop-native-v1","schema_digest":"2f3bc99e53080fa11b39592b64fb0ab964a16f568719a2622d0b2caf766ab629","provenance":{"artifact":"sts2-protocol/coop-native-v1","source":"schemas/coop-native-v1.schema.json","generator":"hand-authored"},"correlation_id":"corr:native:action:unknown","instance_id":"instance:native-test","session_id":"session:native-test","lease_id":"lease:native-test","lease_epoch":7,"kind":"local_action_request","operation_id":"op:native:action:unknown","actor_peer":"peer:host1","expected_host_generation":1,"action":{"kind":"end_turn","action_id":"turn:1","target_peer":null},"vote":null,"status":null,"observation":null,"effect":null,"recovery":null,"catalog":null,"receipt":null}
