{"protocol_version":"coop-native-v1","schema_digest":"2f3bc99e53080fa11b39592b64fb0ab964a16f568719a2622d0b2caf766ab629","provenance":{"artifact":"sts2-protocol/coop-native-v1","source":"schemas/coop-native-v1.schema.json","generator":"hand-authored"},"correlation_id":"corr:native:legal-catalog","instance_id":"instance:native-test","session_id":"session:native-test","lease_id":"lease:native-test","lease_epoch":7,"kind":"legal_catalog_response","operation_id":null,"actor_peer":"peer:host1","expected_host_generation":1,"action":null,"vote":null,"status":null,"observation":{"host_authority_epoch":"epoch:native-test","authority_id":"authority:native-test","run_id":"run:native-test","host_sequence_kind":"adapter_sequence","host_generation":1,"state_digest":"aaaaaaaaaaaaaaaaaaaaaaaaaaaaaaaaaaaaaaaaaaaaaaaaaaaaaaaaaaaaaaaa","checkpoint_id":"checkpoint:1","checksum_algorithm":"sha256","checksum_status":"available","native_checksum":null,"host_digest_known":true,"host_loading":false,"host_divergent":false,"peers":[{"peer_token":"peer:host1","authority_id":"authority:native-test","role":"local","connected":true,"peer_generation":1,"state_digest":"aaaaaaaaaaaaaaaaaaaaaaaaaaaaaaaaaaaaaaaaaaaaaaaaaaaaaaaaaaaaaaaa","rejoin_epoch":0,"authority_epoch":"epoch:native-test","checkpoint_id":"checkpoint:1","digest_known":true,"is_loading":false,"is_divergent":false,"checksum_status":"unavailable"},{"peer_token":"peer:client1","authority_id":"authority:native-test","role":"ally","connected":true,"peer_generation":1,"state_digest":"aaaaaaaaaaaaaaaaaaaaaaaaaaaaaaaaaaaaaaaaaaaaaaaaaaaaaaaaaaaaaaaa","rejoin_epoch":0,"authority_epoch":"epoch:native-test","checkpoint_id":"checkpoint:1","digest_known":true,"is_loading":false,"is_divergent":false,"checksum_status":"unavailable"}]},"effect":null,"recovery":null,"catalog":{"host_generation":1,"actor_peer":"peer:host1","actions":[{"action_id":"turn:1","kind":"end_turn","target_peer":null},{"action_id":"card:strike:0","kind":"play_card","target_peer":null}],"votes":[{"proposal_id":"event:campfire","voter_peer":"peer:host1","choice":"index:1"}]},"receipt":null}
