{"protocol_version":"coop-native-v1","schema_digest":"2f3bc99e53080fa11b39592b64fb0ab964a16f568719a2622d0b2caf766ab629","provenance":{"artifact":"sts2-protocol/coop-native-v1","source":"schemas/coop-native-v1.schema.json","generator":"hand-authored"},"correlation_id":"corr:native:vote:event","instance_id":"instance:native-test","session_id":"session:native-test","lease_id":"lease:native-test","lease_epoch":7,"kind":"shared_vote_request","operation_id":"op:native:vote:event","actor_peer":"peer:host1","expected_host_generation":1,"action":null,"vote":{"proposal_id":"event:campfire","voter_peer":"peer:host1","choice":"index:1"},"status":null,"observation":null,"effect":null,"recovery":null,"catalog":null,"receipt":null}
