{"protocol_version":"coop-native-v1","schema_digest":"2f3bc99e53080fa11b39592b64fb0ab964a16f568719a2622d0b2caf766ab629","provenance":{"artifact":"sts2-protocol/coop-native-v1","source":"schemas/coop-native-v1.schema.json","generator":"hand-authored"},"correlation_id":"corr:native:vote:event","instance_id":"instance:native-test","session_id":"session:native-test","lease_id":"lease:native-test","lease_epoch":7,"kind":"effect_response","operation_id":"op:native:vote:event","actor_peer":null,"expected_host_generation":null,"action":null,"vote":null,"status":"settled","observation":{"host_authority_epoch":"epoch:native-test","authority_id":"authority:native-test","run_id":"run:native-test","host_sequence_kind":"adapter_sequence","host_generation":2,"state_digest":"bbbbbbbbbbbbbbbbbbbbbbbbbbbbbbbbbbbbbbbbbbbbbbbbbbbbbbbbbbbbbbbb","checkpoint_id":"checkpoint:2","checksum_algorithm":"sha256","checksum_status":"available","native_checksum":null,"host_digest_known":true,"host_loading":false,"host_divergent":false,"peers":[{"peer_token":"peer:host1","authority_id":"authority:native-test","role":"local","connected":true,"peer_generation":2,"state_digest":"bbbbbbbbbbbbbbbbbbbbbbbbbbbbbbbbbbbbbbbbbbbbbbbbbbbbbbbbbbbbbbbb","rejoin_epoch":0,"authority_epoch":"epoch:native-test","checkpoint_id":"checkpoint:2","digest_known":true,"is_loading":false,"is_divergent":false,"checksum_status":"unavailable"},{"peer_token":"peer:client1","authority_id":"authority:native-test","role":"ally","connected":true,"peer_generation":2,"state_digest":"bbbbbbbbbbbbbbbbbbbbbbbbbbbbbbbbbbbbbbbbbbbbbbbbbbbbbbbbbbbbbbbb","rejoin_epoch":0,"authority_epoch":"epoch:native-test","checkpoint_id":"checkpoint:2","digest_known":true,"is_loading":false,"is_divergent":false,"checksum_status":"unavailable"}]},"effect":{"effect_id":"effect:op:native:vote:event","operation_id":"op:native:vote:event","kind":"shared_event_vote","from_generation":1,"to_generation":2,"state_digest":"bbbbbbbbbbbbbbbbbbbbbbbbbbbbbbbbbbbbbbbbbbbbbbbbbbbbbbbbbbbbbbbb","authority_epoch":"epoch:native-test","checkpoint_id":"checkpoint:2","authority_id":"authority:native-test","native_checksum":"bbbbbbbbbbbbbbbbbbbbbbbbbbbbbbbbbbbbbbbbbbbbbbbbbbbbbbbbbbbbbbbb"},"recovery":null,"catalog":null,"receipt":{"operation_id":"op:native:vote:event","status":"settled","before_host_generation":1,"after_host_generation":2,"authority_id":"authority:native-test","authority_epoch":"epoch:native-test","checkpoint_id":"checkpoint:2","state_digest":"bbbbbbbbbbbbbbbbbbbbbbbbbbbbbbbbbbbbbbbbbbbbbbbbbbbbbbbbbbbbbbbb","native_checksum":null,"error_code":null}}
